NAICS,NAICS_TITLE
337000,Furniture and Related Product Manufacturing
451110,Sporting Goods Stores
561300,Employment Services
561710,Exterminating and Pest Control Services
541710,"Research and Development in the Physical, Engineering, and Life Sciences"
517900,Other Telecommunications
446100,Health and Personal Care Stores
482000,Rail Transportation
624200,"Community Food and Housing, and Emergency and Other Relief Services"
449200,Electronics and Appliance Retailers
813900,"Business, Professional, Labor, Political, and Similar Organizations"
423200,Furniture and Home Furnishing Merchant Wholesalers
611600,Other Schools and Instruction
